{
  "schema_version": "1.0",
  "generated_at": "2026-07-13T20:58:07.843726+00:00",
  "feed_url": "https://github.com/ChelseaKR/id-churn-sentinel",
  "jurisdiction": "AL",
  "disclaimer": "This feed reports that an official source page changed, with the passage that changed. It does not assert what the law is, and it is not legal advice. Every item was reviewed by a named human before publication. An empty `changes` array means no human has confirmed a change yet \u2014 it is NOT a claim that nothing changed at any watched source.",
  "registry_verification": {
    "scope": "AL",
    "sources": 3,
    "human_verified": 0,
    "unverified": 3,
    "rejected": 0,
    "statement": "THE SOURCE REGISTRY IS NOT HUMAN-VERIFIED. Each entry is a CANDIDATE official URL: our own crawler fetched it and read its title, and its `verification_status` says whether a named human has since confirmed it is the official page for that document class in that jurisdiction. `unverified` means nobody has. A machine cannot tell a state's real birth-certificate page from a convincing-looking one \u2014 it cannot even tell a live page from a bot-wall served with HTTP 200 \u2014 so do not rely on an unverified entry as authoritative guidance, and do not present it to anyone as one. What this tool does claim: this URL changed, and here is what changed in it. What it never claims: what the law is."
  },
  "changes": [],
  "sources": [
    {
      "source_id": "al-adph-vital-records",
      "jurisdiction": "AL",
      "document_class": "birth_certificate",
      "url": "https://www.alabamapublichealth.gov/vitalrecords/",
      "authority": "Alabama Department of Public Health, Center for Health Statistics (Vital Records)",
      "verification_status": "unverified",
      "human_verified": false,
      "verified_by": "",
      "verified_at": "",
      "verification_statement": "UNVERIFIED \u2014 machine-checked, not human-confirmed. A live fetch confirmed this URL answers and its title was read; NO HUMAN has confirmed that it is the official page for this document class in this jurisdiction. Do not rely on it as authoritative guidance.",
      "reachable_by_our_crawler": true,
      "notes": "live-fetched. HTTP 200, title 'Vital Records | Alabama Department of Public Health (ADPH)', h1 'Vital Records'."
    },
    {
      "source_id": "al-alea-driver-license",
      "jurisdiction": "AL",
      "document_class": "drivers_license",
      "url": "https://www.alea.gov/dps/driver-license",
      "authority": "Alabama Law Enforcement Agency, Driver License Division",
      "verification_status": "unverified",
      "human_verified": false,
      "verified_by": "",
      "verified_at": "",
      "verification_statement": "UNVERIFIED \u2014 machine-checked, not human-confirmed. A live fetch confirmed this URL answers and its title was read; NO HUMAN has confirmed that it is the official page for this document class in this jurisdiction. Do not rely on it as authoritative guidance.",
      "reachable_by_our_crawler": true,
      "notes": "live-fetched. HTTP 200, title 'Driver License | Alabama Law Enforcement Agency', h1 'Driver License'."
    },
    {
      "source_id": "al-judicial-system",
      "jurisdiction": "AL",
      "document_class": "court_order_name_change",
      "url": "https://judicial.alabama.gov/",
      "authority": "Alabama Judicial System (Administrative Office of Courts)",
      "verification_status": "unverified",
      "human_verified": false,
      "verified_by": "",
      "verified_at": "",
      "verification_statement": "UNVERIFIED \u2014 machine-checked, not human-confirmed. A live fetch confirmed this URL answers and its title was read; NO HUMAN has confirmed that it is the official page for this document class in this jurisdiction. Do not rely on it as authoritative guidance.",
      "reachable_by_our_crawler": true,
      "notes": "live-fetched. HTTP 200, h1 'ALABAMA JUDICIAL SYSTEM'. A landing page: no statewide name-change instruction page was found, and alacourt.gov (the case-lookup host) does not resolve for us at all. Recorded as a landing page rather than invented as a deep link."
    }
  ]
}
