{
  "schema_version": "1.0",
  "generated_at": "2026-07-13T20:58:07.843726+00:00",
  "feed_url": "https://github.com/ChelseaKR/id-churn-sentinel",
  "jurisdiction": "VT",
  "disclaimer": "This feed reports that an official source page changed, with the passage that changed. It does not assert what the law is, and it is not legal advice. Every item was reviewed by a named human before publication. An empty `changes` array means no human has confirmed a change yet \u2014 it is NOT a claim that nothing changed at any watched source.",
  "registry_verification": {
    "scope": "VT",
    "sources": 2,
    "human_verified": 0,
    "unverified": 2,
    "rejected": 0,
    "statement": "THE SOURCE REGISTRY IS NOT HUMAN-VERIFIED. Each entry is a CANDIDATE official URL: our own crawler fetched it and read its title, and its `verification_status` says whether a named human has since confirmed it is the official page for that document class in that jurisdiction. `unverified` means nobody has. A machine cannot tell a state's real birth-certificate page from a convincing-looking one \u2014 it cannot even tell a live page from a bot-wall served with HTTP 200 \u2014 so do not rely on an unverified entry as authoritative guidance, and do not present it to anyone as one. What this tool does claim: this URL changed, and here is what changed in it. What it never claims: what the law is."
  },
  "changes": [],
  "sources": [
    {
      "source_id": "vt-judiciary",
      "jurisdiction": "VT",
      "document_class": "court_order_name_change",
      "url": "https://www.vtcourts.gov/",
      "authority": "Vermont Judiciary",
      "verification_status": "unverified",
      "human_verified": false,
      "verified_by": "",
      "verified_at": "",
      "verification_statement": "UNVERIFIED \u2014 machine-checked, not human-confirmed. A live fetch confirmed this URL answers and its title was read; NO HUMAN has confirmed that it is the official page for this document class in this jurisdiction. Do not rely on it as authoritative guidance.",
      "reachable_by_our_crawler": true,
      "notes": "live-fetched. HTTP 200 after a redirect from vermontjudiciary.org (post-redirect URL recorded), title 'Vermont Judiciary'. Vermont's DMV 403s our crawler \u2014 see KNOWN GAPS."
    },
    {
      "source_id": "vt-vital-records",
      "jurisdiction": "VT",
      "document_class": "birth_certificate",
      "url": "https://www.healthvermont.gov/stats",
      "authority": "Vermont Department of Health, Vital Records Office",
      "verification_status": "unverified",
      "human_verified": false,
      "verified_by": "",
      "verified_at": "",
      "verification_statement": "UNVERIFIED \u2014 machine-checked, not human-confirmed. A live fetch confirmed this URL answers and its title was read; NO HUMAN has confirmed that it is the official page for this document class in this jurisdiction. Do not rely on it as authoritative guidance.",
      "reachable_by_our_crawler": true,
      "notes": "live-fetched. HTTP 200 after a redirect (post-redirect URL recorded), h1 'Health Statistics & Vital Records'."
    }
  ]
}
